{
  "schema": "external-normative-source/0.1",
  "source_id": "ens:slsa:1.2",
  "kind": "SPECIFICATION",
  "title": "Supply-chain Levels for Software Artifacts specification",
  "publisher": {
    "name": "SLSA",
    "uri": "https://slsa.dev/"
  },
  "canonical_uri": "https://slsa.dev/spec/v1.2/",
  "release_version": "1.2",
  "status": {
    "source_declared": true,
    "raw": "Approved",
    "normalized": "APPROVED"
  },
  "observed_at": "2026-09-19T10:06:00Z",
  "primary_source_ref": "https://slsa.dev/spec/v1.2/",
  "media_type": "text/html"
}
